{
  "$schema": "https://json-schema.org/draft/2020-12/schema",
  "title": "KeychainModelParams",
  "description": "Parametri di configurazione per il generatore di portachiavi Snapmaker U1",
  "type": "object",
  "properties": {
    "generator": {
      "type": "string",
      "const": "keychain",
      "description": "Identificativo del template di generazione"
    },
    "text": {
      "type": "string",
      "minLength": 1,
      "maxLength": 30,
      "default": "ANTONELLO",
      "description": "Stringa di testo personalizzata"
    },
    "font_family": {
      "type": "string",
      "default": "Arial",
      "description": "Famiglia di font TrueType/OpenType o nome del font caricato"
    },
    "font_path": {
      "type": "string",
      "description": "Percorso facoltativo del file .ttf / .otf caricato dall'utente"
    },
    "font_size": {
      "type": "number",
      "minimum": 6.0,
      "maximum": 35.0,
      "default": 14.0,
      "description": "Dimensione nominale del carattere in millimetri"
    },
    "letter_spacing": {
      "type": "number",
      "minimum": -2.0,
      "maximum": 10.0,
      "default": 0.0,
      "description": "Spaziatura aggiuntiva tra lettere in mm (tracking)"
    },
    "base_style": {
      "type": "string",
      "enum": ["rectangle", "contour"],
      "default": "rectangle",
      "description": "Stile della base: rettangolare arrotondata o silhouette sagomata sul testo"
    },
    "base_thickness": {
      "type": "number",
      "minimum": 1.2,
      "maximum": 8.0,
      "default": 2.4,
      "description": "Spessore in Z della base in mm"
    },
    "text_thickness": {
      "type": "number",
      "minimum": 0.6,
      "maximum": 5.0,
      "default": 1.2,
      "description": "Altezza del testo (in rilievo o profondità di intaglio) in mm"
    },
    "text_mode": {
      "type": "string",
      "enum": ["embossed", "debossed", "flush"],
      "default": "embossed",
      "description": "Lavorazione testo: rilievo sopra la base, scavato, o a filo con superficie inferiore PEI"
    },
    "corner_radius": {
      "type": "number",
      "minimum": 1.0,
      "maximum": 15.0,
      "default": 4.0,
      "description": "Raggio di curvatura degli angoli della base in mm"
    },
    "padding_x": {
      "type": "number",
      "minimum": 2.0,
      "maximum": 20.0,
      "default": 5.0,
      "description": "Margine orizzontale dal testo ai bordi laterali in mm"
    },
    "padding_y": {
      "type": "number",
      "minimum": 2.0,
      "maximum": 20.0,
      "default": 4.5,
      "description": "Margine verticale dal testo ai bordi superiore/inferiore in mm"
    },
    "hole_enabled": {
      "type": "boolean",
      "default": true,
      "description": "Se disattivato, il modello diventa una targhetta senza foro anello"
    },
    "hole_position": {
      "type": "string",
      "enum": ["left", "right", "top"],
      "default": "left",
      "description": "Posizione del foro portachiavi"
    },
    "hole_diameter": {
      "type": "number",
      "minimum": 3.0,
      "maximum": 10.0,
      "default": 5.0,
      "description": "Diametro interno del foro per l'anello in mm"
    },
    "icon_name": {
      "type": "string",
      "enum": ["none", "heart", "star", "paw", "lightning", "crown"],
      "default": "none",
      "description": "Sagoma/icona vettoriale accanto al testo"
    },
    "icon_position": {
      "type": "string",
      "enum": ["left", "right"],
      "default": "left",
      "description": "Posizione dell'icona (a sinistra o a destra del testo)"
    },
    "extruder_base": {
      "type": "integer",
      "minimum": 0,
      "maximum": 3,
      "default": 0,
      "description": "Utensile Snapmaker U1 per la base (0=T0, 1=T1, 2=T2, 3=T3)"
    },
    "extruder_text": {
      "type": "integer",
      "minimum": 0,
      "maximum": 3,
      "default": 1,
      "description": "Utensile Snapmaker U1 per il testo (0=T0, 1=T1, 2=T2, 3=T3)"
    },
    "extruder_icon": {
      "type": "integer",
      "minimum": 0,
      "maximum": 3,
      "default": 1,
      "description": "Utensile Snapmaker U1 per l'icona (0=T0, 1=T1, 2=T2, 3=T3)"
    },
    "filament_colors": {
      "type": "array",
      "items": { "type": "string", "pattern": "^#[0-9A-Fa-f]{6}$" },
      "minItems": 4,
      "maxItems": 4,
      "default": ["#000000", "#FFFFFF", "#E31B23", "#FFD700"],
      "description": "Colori esadecimali associati rispettivamente ai 4 slot T0, T1, T2, T3"
    },
    "filament_names": {
      "type": "array",
      "items": { "type": "string" },
      "minItems": 4,
      "maxItems": 4,
      "default": ["Nero", "Bianco", "Rosso", "Giallo"],
      "description": "Etichette descrittive per i filamenti dei 4 slot"
    }
  },
  "required": ["text", "generator"]
}
